{
  "contractVersion": "0.1-draft",
  "kind": "plugin-manifest",
  "id": "org.example/catalog-plugin",
  "version": "1.0.0",
  "owner": {
    "id": "org.example/catalog",
    "version": "1.0.0"
  },
  "label": {
    "key": "org.example.catalog/plugin",
    "defaultMessage": "Catalog Studio integration"
  },
  "activation": "declarative",
  "entryModules": [],
  "contributions": [
    {
      "kind": "authoring-target",
      "id": "org.example.catalog/product-content",
      "version": "1.0.0",
      "resource": "authoring/product-content.json",
      "integrity": "sha256-8UXhVSSK8qpAIeINL/EZAeMXvriQ6Xy97BKjuvI2gTU=",
      "executable": false
    },
    {
      "kind": "block",
      "id": "org.example.catalog/price",
      "version": "1.0.0",
      "resource": "blocks/price.json",
      "integrity": "sha256-gEReHtrWQj4XVxU9b3Yie2ssI8Wsy/nv+rvEe6RcFac=",
      "executable": false
    },
    {
      "kind": "locale",
      "id": "org.example.catalog/en",
      "version": "1.0.0",
      "resource": "locales/en.json",
      "integrity": "sha256-5sNWsx8n/MDESzjxSwhjg4AnBq/6Mtur4NX0cWTHkKg=",
      "executable": false
    }
  ],
  "requiredCapabilities": [
    {
      "id": "studio.capability/contextual-authoring",
      "versions": "^1.0.0"
    },
    {
      "id": "studio.host/artifact",
      "versions": "^1.0.0"
    }
  ],
  "optionalCapabilities": [
    {
      "id": "studio.host/media",
      "versions": "^1.0.0"
    }
  ],
  "dependencies": [],
  "permissions": ["org.example.catalog/read-product"],
  "locales": ["en"]
}
